{
  "artifact_kind": "binary-vector-plan",
  "populated_binary_vectors": false,
  "requirements": [
    {
      "planned_vector_ids": [
        "ESRM-P22-MUST-001-POS-PLAN",
        "ESRM-P22-MUST-001-NEG-PLAN"
      ],
      "requirement_id": "ESRM-P22-MUST-001",
      "status": "planned"
    },
    {
      "planned_vector_ids": [
        "ESRM-P22-MUST-002-NEG-PLAN"
      ],
      "requirement_id": "ESRM-P22-MUST-002",
      "status": "planned"
    },
    {
      "planned_vector_ids": [
        "ESRM-P22-MUST-003-POS-PLAN",
        "ESRM-P22-MUST-003-NEG-PLAN"
      ],
      "requirement_id": "ESRM-P22-MUST-003",
      "status": "planned"
    },
    {
      "planned_vector_ids": [
        "ESRM-P22-MUST-NOT-001-NEG-PLAN"
      ],
      "requirement_id": "ESRM-P22-MUST-NOT-001",
      "status": "planned"
    },
    {
      "planned_vector_ids": [
        "ESRM-P22-MUST-NOT-002-NEG-PLAN"
      ],
      "requirement_id": "ESRM-P22-MUST-NOT-002",
      "status": "planned"
    },
    {
      "planned_vector_ids": [
        "ESRM-P23-MUST-001-POS-PLAN",
        "ESRM-P23-MUST-001-NEG-PLAN"
      ],
      "requirement_id": "ESRM-P23-MUST-001",
      "status": "planned"
    },
    {
      "planned_vector_ids": [
        "ESRM-P23-MUST-002-POS-PLAN",
        "ESRM-P23-MUST-002-NEG-PLAN"
      ],
      "requirement_id": "ESRM-P23-MUST-002",
      "status": "planned"
    },
    {
      "planned_vector_ids": [
        "ESRM-P23-MUST-003-POS-PLAN",
        "ESRM-P23-MUST-003-NEG-PLAN"
      ],
      "requirement_id": "ESRM-P23-MUST-003",
      "status": "planned"
    },
    {
      "planned_vector_ids": [
        "ESRM-P23-MUST-NOT-001-NEG-PLAN"
      ],
      "requirement_id": "ESRM-P23-MUST-NOT-001",
      "status": "planned"
    },
    {
      "planned_vector_ids": [
        "ESRM-P23-MUST-NOT-002-NEG-PLAN"
      ],
      "requirement_id": "ESRM-P23-MUST-NOT-002",
      "status": "planned"
    },
    {
      "planned_vector_ids": [
        "ESRM-P24-MUST-001-POS-PLAN",
        "ESRM-P24-MUST-001-NEG-PLAN"
      ],
      "requirement_id": "ESRM-P24-MUST-001",
      "status": "planned"
    },
    {
      "planned_vector_ids": [
        "ESRM-P24-MUST-002-POS-PLAN",
        "ESRM-P24-MUST-002-NEG-PLAN"
      ],
      "requirement_id": "ESRM-P24-MUST-002",
      "status": "planned"
    },
    {
      "planned_vector_ids": [
        "ESRM-P24-MUST-003-POS-PLAN",
        "ESRM-P24-MUST-003-NEG-PLAN"
      ],
      "requirement_id": "ESRM-P24-MUST-003",
      "status": "planned"
    },
    {
      "planned_vector_ids": [
        "ESRM-P24-MUST-NOT-001-NEG-PLAN"
      ],
      "requirement_id": "ESRM-P24-MUST-NOT-001",
      "status": "planned"
    },
    {
      "planned_vector_ids": [
        "ESRM-P24-MUST-NOT-002-NEG-PLAN"
      ],
      "requirement_id": "ESRM-P24-MUST-NOT-002",
      "status": "planned"
    },
    {
      "planned_vector_ids": [
        "ESRM-P24-MUST-NOT-003-NEG-PLAN"
      ],
      "requirement_id": "ESRM-P24-MUST-NOT-003",
      "status": "planned"
    },
    {
      "planned_vector_ids": [
        "ESRM-P24-MUST-NOT-004-NEG-PLAN"
      ],
      "requirement_id": "ESRM-P24-MUST-NOT-004",
      "status": "planned"
    },
    {
      "planned_vector_ids": [
        "ESRM-P25-MUST-001-POS-PLAN",
        "ESRM-P25-MUST-001-NEG-PLAN"
      ],
      "requirement_id": "ESRM-P25-MUST-001",
      "status": "planned"
    },
    {
      "planned_vector_ids": [
        "ESRM-P25-MUST-002-POS-PLAN",
        "ESRM-P25-MUST-002-NEG-PLAN"
      ],
      "requirement_id": "ESRM-P25-MUST-002",
      "status": "planned"
    },
    {
      "planned_vector_ids": [
        "ESRM-P25-MUST-003-POS-PLAN",
        "ESRM-P25-MUST-003-NEG-PLAN"
      ],
      "requirement_id": "ESRM-P25-MUST-003",
      "status": "planned"
    },
    {
      "planned_vector_ids": [
        "ESRM-P25-MUST-004-POS-PLAN",
        "ESRM-P25-MUST-004-NEG-PLAN"
      ],
      "requirement_id": "ESRM-P25-MUST-004",
      "status": "planned"
    },
    {
      "planned_vector_ids": [
        "ESRM-P25-MUST-NOT-001-NEG-PLAN"
      ],
      "requirement_id": "ESRM-P25-MUST-NOT-001",
      "status": "planned"
    },
    {
      "planned_vector_ids": [
        "ESRM-P25-MUST-NOT-002-NEG-PLAN"
      ],
      "requirement_id": "ESRM-P25-MUST-NOT-002",
      "status": "planned"
    },
    {
      "planned_vector_ids": [
        "ESRM-P26-MUST-001-POS-PLAN",
        "ESRM-P26-MUST-001-NEG-PLAN"
      ],
      "requirement_id": "ESRM-P26-MUST-001",
      "status": "planned"
    },
    {
      "planned_vector_ids": [
        "ESRM-P26-MUST-002-POS-PLAN",
        "ESRM-P26-MUST-002-NEG-PLAN"
      ],
      "requirement_id": "ESRM-P26-MUST-002",
      "status": "planned"
    },
    {
      "planned_vector_ids": [
        "ESRM-P26-MUST-003-POS-PLAN",
        "ESRM-P26-MUST-003-NEG-PLAN"
      ],
      "requirement_id": "ESRM-P26-MUST-003",
      "status": "planned"
    },
    {
      "planned_vector_ids": [
        "ESRM-P26-MUST-004-POS-PLAN",
        "ESRM-P26-MUST-004-NEG-PLAN"
      ],
      "requirement_id": "ESRM-P26-MUST-004",
      "status": "planned"
    },
    {
      "planned_vector_ids": [
        "ESRM-P26-MUST-NOT-001-NEG-PLAN"
      ],
      "requirement_id": "ESRM-P26-MUST-NOT-001",
      "status": "planned"
    },
    {
      "planned_vector_ids": [
        "ESRM-P26-MUST-NOT-002-NEG-PLAN"
      ],
      "requirement_id": "ESRM-P26-MUST-NOT-002",
      "status": "planned"
    },
    {
      "planned_vector_ids": [
        "ESRM-P27-MUST-001-POS-PLAN",
        "ESRM-P27-MUST-001-NEG-PLAN"
      ],
      "requirement_id": "ESRM-P27-MUST-001",
      "status": "planned"
    },
    {
      "planned_vector_ids": [
        "ESRM-P27-MUST-002-POS-PLAN",
        "ESRM-P27-MUST-002-NEG-PLAN"
      ],
      "requirement_id": "ESRM-P27-MUST-002",
      "status": "planned"
    },
    {
      "planned_vector_ids": [
        "ESRM-P27-MUST-003-POS-PLAN",
        "ESRM-P27-MUST-003-NEG-PLAN"
      ],
      "requirement_id": "ESRM-P27-MUST-003",
      "status": "planned"
    },
    {
      "planned_vector_ids": [
        "ESRM-P27-MUST-004-POS-PLAN",
        "ESRM-P27-MUST-004-NEG-PLAN"
      ],
      "requirement_id": "ESRM-P27-MUST-004",
      "status": "planned"
    },
    {
      "planned_vector_ids": [
        "ESRM-P27-MUST-005-POS-PLAN",
        "ESRM-P27-MUST-005-NEG-PLAN"
      ],
      "requirement_id": "ESRM-P27-MUST-005",
      "status": "planned"
    },
    {
      "planned_vector_ids": [
        "ESRM-P27-MUST-NOT-001-NEG-PLAN"
      ],
      "requirement_id": "ESRM-P27-MUST-NOT-001",
      "status": "planned"
    },
    {
      "planned_vector_ids": [
        "ESRM-P27-MUST-NOT-002-NEG-PLAN"
      ],
      "requirement_id": "ESRM-P27-MUST-NOT-002",
      "status": "planned"
    },
    {
      "planned_vector_ids": [
        "ESRM-P28-MUST-001-POS-PLAN",
        "ESRM-P28-MUST-001-NEG-PLAN"
      ],
      "requirement_id": "ESRM-P28-MUST-001",
      "status": "planned"
    },
    {
      "planned_vector_ids": [
        "ESRM-P28-MUST-002-POS-PLAN",
        "ESRM-P28-MUST-002-NEG-PLAN"
      ],
      "requirement_id": "ESRM-P28-MUST-002",
      "status": "planned"
    },
    {
      "planned_vector_ids": [
        "ESRM-P28-MUST-003-POS-PLAN",
        "ESRM-P28-MUST-003-NEG-PLAN"
      ],
      "requirement_id": "ESRM-P28-MUST-003",
      "status": "planned"
    },
    {
      "planned_vector_ids": [
        "ESRM-P28-MUST-004-POS-PLAN",
        "ESRM-P28-MUST-004-NEG-PLAN"
      ],
      "requirement_id": "ESRM-P28-MUST-004",
      "status": "planned"
    },
    {
      "planned_vector_ids": [
        "ESRM-P28-MUST-005-POS-PLAN",
        "ESRM-P28-MUST-005-NEG-PLAN"
      ],
      "requirement_id": "ESRM-P28-MUST-005",
      "status": "planned"
    },
    {
      "planned_vector_ids": [
        "ESRM-P28-MUST-006-POS-PLAN",
        "ESRM-P28-MUST-006-NEG-PLAN"
      ],
      "requirement_id": "ESRM-P28-MUST-006",
      "status": "planned"
    },
    {
      "planned_vector_ids": [
        "ESRM-P28-MUST-007-POS-PLAN",
        "ESRM-P28-MUST-007-NEG-PLAN"
      ],
      "requirement_id": "ESRM-P28-MUST-007",
      "status": "planned"
    },
    {
      "planned_vector_ids": [
        "ESRM-P28-MUST-NOT-001-NEG-PLAN"
      ],
      "requirement_id": "ESRM-P28-MUST-NOT-001",
      "status": "planned"
    },
    {
      "planned_vector_ids": [
        "ESRM-P29-MUST-001-POS-PLAN",
        "ESRM-P29-MUST-001-NEG-PLAN"
      ],
      "requirement_id": "ESRM-P29-MUST-001",
      "status": "planned"
    },
    {
      "planned_vector_ids": [
        "ESRM-P29-MUST-002-POS-PLAN",
        "ESRM-P29-MUST-002-NEG-PLAN"
      ],
      "requirement_id": "ESRM-P29-MUST-002",
      "status": "planned"
    },
    {
      "planned_vector_ids": [
        "ESRM-P29-MUST-003-POS-PLAN",
        "ESRM-P29-MUST-003-NEG-PLAN"
      ],
      "requirement_id": "ESRM-P29-MUST-003",
      "status": "planned"
    },
    {
      "planned_vector_ids": [
        "ESRM-P29-MUST-004-POS-PLAN",
        "ESRM-P29-MUST-004-NEG-PLAN"
      ],
      "requirement_id": "ESRM-P29-MUST-004",
      "status": "planned"
    },
    {
      "planned_vector_ids": [
        "ESRM-P29-MUST-005-POS-PLAN",
        "ESRM-P29-MUST-005-NEG-PLAN"
      ],
      "requirement_id": "ESRM-P29-MUST-005",
      "status": "planned"
    },
    {
      "planned_vector_ids": [
        "ESRM-P29-MUST-NOT-001-NEG-PLAN"
      ],
      "requirement_id": "ESRM-P29-MUST-NOT-001",
      "status": "planned"
    },
    {
      "planned_vector_ids": [
        "ESRM-P29-MUST-NOT-002-NEG-PLAN"
      ],
      "requirement_id": "ESRM-P29-MUST-NOT-002",
      "status": "planned"
    },
    {
      "planned_vector_ids": [
        "ESRM-P30-MUST-001-POS-PLAN",
        "ESRM-P30-MUST-001-NEG-PLAN"
      ],
      "requirement_id": "ESRM-P30-MUST-001",
      "status": "planned"
    },
    {
      "planned_vector_ids": [
        "ESRM-P30-MUST-002-POS-PLAN",
        "ESRM-P30-MUST-002-NEG-PLAN"
      ],